{
  "version": 1,
  "orgId": "org_example",
  "machineId": "machine_example",
  "agentId": "agent_example",
  "sessionId": "session_example",
  "displayId": "display-1",
  "displays": [
    {
      "id": "display-1",
      "name": "Primary",
      "x": 0,
      "y": 0,
      "width": 1920,
      "height": 1080,
      "primary": true
    },
    {
      "id": "display-2",
      "name": "Secondary",
      "x": 1920,
      "y": 0,
      "width": 2560,
      "height": 1440,
      "primary": false
    }
  ]
}
